{
  "$schema": "../../../governance/canonical/schemas/provider-hook-coverage.schema.json",
  "schemaVersion": 2,
  "generated": {
    "generator": "scripts/gen-codex-adapter.mjs",
    "canonicalHookRegistry": "packages/design-system/ds-canonical/hooks/registrations.json",
    "providerRegistry": "packages/governance/canonical/providers.json",
    "inputSha256": {
      "hookRegistrations": "sha256:923fe1cd0af9b960729002f5b1fa1eced1e8f59bdd057b15a6b5a6b5f31678b4",
      "providerRegistry": "sha256:c8c96ab26ea34a73d6223c57cad875bbc57fbb00407850f6537b8f71c5016508",
      "coverageSchema": "sha256:7320ac4cf37a731f1e79428bad46561e285a491460c3daf16b9bb42bdd1765a4"
    }
  },
  "policy": {
    "nativeProjectionIsFeedbackOnly": true,
    "nativeProjectionIsSecurityBoundary": false,
    "ciEquivalenceRequiresHookSpecificEvidence": true,
    "absenceOfProvenFallbackOutcome": "not-certified"
  },
  "providers": [
    {
      "provider": "claude",
      "nativeHooksDeclared": true,
      "hookEnforcement": "native-feedback-plus-ci",
      "projectionStatus": "complete-projection",
      "certificationClaim": "projection-only-not-runtime-certified",
      "canonicalRegistrationCount": 62,
      "projectedCount": 62,
      "excludedCount": 0,
      "projected": [
        {
          "event": "PreToolUse",
          "canonicalMatcher": "Edit|Write|MultiEdit",
          "hook": "governance_control_plane.sh",
          "kind": "hook",
          "runtime": "bash",
          "outputMode": "governance-context-or-block",
          "inputContract": "event-v1",
          "transcriptRequirement": "none",
          "requirements": [],
          "nativeEvent": "PreToolUse",
          "projectedMatcher": "Edit|Write|MultiEdit",
          "nativeCoverage": "projected",
          "certificationImpact": "runtime-certification-required"
        },
        {
          "event": "PreToolUse",
          "canonicalMatcher": "Bash|mcp__github__create_pull_request|mcp__github__merge_pull_request",
          "hook": "check_solo_workflow.sh",
          "kind": "hook",
          "runtime": "bash",
          "outputMode": "blocking",
          "inputContract": "event-v1",
          "transcriptRequirement": "stable-required",
          "requirements": [],
          "nativeEvent": "PreToolUse",
          "projectedMatcher": "Bash|mcp__github__create_pull_request|mcp__github__merge_pull_request",
          "nativeCoverage": "projected",
          "certificationImpact": "runtime-certification-required"
        },
        {
          "event": "PreToolUse",
          "canonicalMatcher": "Bash|mcp__github__create_pull_request|mcp__github__merge_pull_request",
          "hook": "check_codex_collab_5step.sh",
          "kind": "hook",
          "runtime": "bash",
          "outputMode": "diagnostic",
          "inputContract": "event-v1",
          "transcriptRequirement": "none",
          "requirements": [
            "peer-review-binding"
          ],
          "nativeEvent": "PreToolUse",
          "projectedMatcher": "Bash|mcp__github__create_pull_request|mcp__github__merge_pull_request",
          "nativeCoverage": "projected",
          "certificationImpact": "runtime-certification-required"
        },
        {
          "event": "PreToolUse",
          "canonicalMatcher": "Agent|Task|Workflow",
          "hook": "check_audit_sample_escape.sh",
          "kind": "hook",
          "runtime": "bash",
          "outputMode": "blocking",
          "inputContract": "event-v1",
          "transcriptRequirement": "none",
          "requirements": [],
          "nativeEvent": "PreToolUse",
          "projectedMatcher": "Agent|Task|Workflow",
          "nativeCoverage": "projected",
          "certificationImpact": "runtime-certification-required"
        },
        {
          "event": "PreToolUse",
          "canonicalMatcher": "Bash",
          "hook": "check_codex_brief_invariants.sh",
          "kind": "hook",
          "runtime": "bash",
          "outputMode": "blocking",
          "inputContract": "event-v1",
          "transcriptRequirement": "none",
          "requirements": [
            "peer-cli"
          ],
          "nativeEvent": "PreToolUse",
          "projectedMatcher": "Bash",
          "nativeCoverage": "projected",
          "certificationImpact": "runtime-certification-required"
        },
        {
          "event": "PreToolUse",
          "canonicalMatcher": "Write",
          "hook": "enforce_home_charter.sh",
          "kind": "hook",
          "runtime": "bash",
          "outputMode": "blocking",
          "inputContract": "event-v1",
          "transcriptRequirement": "none",
          "requirements": [],
          "nativeEvent": "PreToolUse",
          "projectedMatcher": "Write",
          "nativeCoverage": "projected",
          "certificationImpact": "runtime-certification-required"
        },
        {
          "event": "PreToolUse",
          "canonicalMatcher": "Edit|Write|MultiEdit",
          "hook": "check_file_size_budget.sh",
          "kind": "hook",
          "runtime": "bash",
          "outputMode": "governance-context",
          "inputContract": "event-v1",
          "transcriptRequirement": "none",
          "requirements": [],
          "nativeEvent": "PreToolUse",
          "projectedMatcher": "Edit|Write|MultiEdit",
          "nativeCoverage": "projected",
          "certificationImpact": "runtime-certification-required"
        },
        {
          "event": "PreToolUse",
          "canonicalMatcher": "Edit|Write|MultiEdit",
          "hook": "check_story_invariants.sh",
          "kind": "hook",
          "runtime": "bash",
          "outputMode": "governance-context-or-block",
          "inputContract": "proposed-text-v1",
          "transcriptRequirement": "none",
          "requirements": [],
          "nativeEvent": "PreToolUse",
          "projectedMatcher": "Edit|Write|MultiEdit",
          "nativeCoverage": "projected",
          "certificationImpact": "runtime-certification-required"
        },
        {
          "event": "PreToolUse",
          "canonicalMatcher": "Edit|Write|MultiEdit",
          "hook": "check_canonical_propagation.sh",
          "kind": "hook",
          "runtime": "bash",
          "outputMode": "governance-context-or-block",
          "inputContract": "event-v1",
          "transcriptRequirement": "none",
          "requirements": [],
          "nativeEvent": "PreToolUse",
          "projectedMatcher": "Edit|Write|MultiEdit",
          "nativeCoverage": "projected",
          "certificationImpact": "runtime-certification-required"
        },
        {
          "event": "PreToolUse",
          "canonicalMatcher": "Edit|Write|MultiEdit",
          "hook": "check_pattern_invariants.sh",
          "kind": "hook",
          "runtime": "bash",
          "outputMode": "governance-context-or-block",
          "inputContract": "event-v1",
          "transcriptRequirement": "none",
          "requirements": [],
          "nativeEvent": "PreToolUse",
          "projectedMatcher": "Edit|Write|MultiEdit",
          "nativeCoverage": "projected",
          "certificationImpact": "runtime-certification-required"
        },
        {
          "event": "PreToolUse",
          "canonicalMatcher": "Edit|Write|MultiEdit",
          "hook": "check_naming_and_abstraction.sh",
          "kind": "hook",
          "runtime": "bash",
          "outputMode": "governance-context-or-block",
          "inputContract": "event-v1",
          "transcriptRequirement": "none",
          "requirements": [],
          "nativeEvent": "PreToolUse",
          "projectedMatcher": "Edit|Write|MultiEdit",
          "nativeCoverage": "projected",
          "certificationImpact": "runtime-certification-required"
        },
        {
          "event": "PreToolUse",
          "canonicalMatcher": "Edit|Write|MultiEdit",
          "hook": "check_benchmark_citation.sh",
          "kind": "hook",
          "runtime": "bash",
          "outputMode": "blocking",
          "inputContract": "event-v1",
          "transcriptRequirement": "none",
          "requirements": [],
          "nativeEvent": "PreToolUse",
          "projectedMatcher": "Edit|Write|MultiEdit",
          "nativeCoverage": "projected",
          "certificationImpact": "runtime-certification-required"
        },
        {
          "event": "PreToolUse",
          "canonicalMatcher": "Edit|Write|MultiEdit",
          "hook": "check_wrapper_primitive_schema_drift.sh",
          "kind": "hook",
          "runtime": "bash",
          "outputMode": "governance-context-or-block",
          "inputContract": "event-v1",
          "transcriptRequirement": "none",
          "requirements": [],
          "nativeEvent": "PreToolUse",
          "projectedMatcher": "Edit|Write|MultiEdit",
          "nativeCoverage": "projected",
          "certificationImpact": "runtime-certification-required"
        },
        {
          "event": "PreToolUse",
          "canonicalMatcher": "Edit|Write|MultiEdit",
          "hook": "check_field_family_invariants.sh",
          "kind": "hook",
          "runtime": "bash",
          "outputMode": "governance-context-or-block",
          "inputContract": "event-v1",
          "transcriptRequirement": "none",
          "requirements": [],
          "nativeEvent": "PreToolUse",
          "projectedMatcher": "Edit|Write|MultiEdit",
          "nativeCoverage": "projected",
          "certificationImpact": "runtime-certification-required"
        },
        {
          "event": "PreToolUse",
          "canonicalMatcher": "Edit|Write|MultiEdit",
          "hook": "check_datatable_invariants.sh",
          "kind": "hook",
          "runtime": "bash",
          "outputMode": "governance-context",
          "inputContract": "event-v1",
          "transcriptRequirement": "none",
          "requirements": [],
          "nativeEvent": "PreToolUse",
          "projectedMatcher": "Edit|Write|MultiEdit",
          "nativeCoverage": "projected",